{
  "$schema": "https://json-schema.org/draft/2020-12/schema",
  "title": "Repo Harness Feature List",
  "type": "object",
  "required": [
    "features"
  ],
  "properties": {
    "$schema": {
      "type": "string"
    },
    "project": {
      "type": "string"
    },
    "last_updated": {
      "type": "string"
    },
    "rules": {
      "type": "object"
    },
    "status_legend": {
      "type": "object"
    },
    "features": {
      "type": "array",
      "items": {
        "type": "object",
        "required": [
          "id",
          "priority",
          "area",
          "title",
          "user_visible_behavior",
          "status",
          "verification",
          "evidence"
        ],
        "properties": {
          "id": {
            "type": "string"
          },
          "priority": {
            "type": "integer"
          },
          "area": {
            "type": "string"
          },
          "title": {
            "type": "string"
          },
          "user_visible_behavior": {
            "type": "string"
          },
          "status": {
            "type": "string",
            "enum": [
              "not_started",
              "planned",
              "active",
              "blocked",
              "passing",
              "done"
            ]
          },
          "dependencies": {
            "type": "array",
            "items": {
              "type": "string"
            }
          },
          "verification": {
            "type": "array",
            "items": {
              "type": "string"
            }
          },
          "evidence": {
            "type": "array",
            "items": {
              "type": "string"
            }
          },
          "notes": {
            "type": "string"
          }
        },
        "additionalProperties": true
      }
    }
  },
  "additionalProperties": true
}
