{
  "$schema": "docs/harness/schemas/feature-list.schema.json",
  "project": "RunHaven",
  "last_updated": "2026-06-26",
  "rules": {
    "single_active_feature": true,
    "passing_requires_evidence": true,
    "startup_context_must_stay_small": true
  },
  "status_legend": {
    "not_started": "Identified but no work or acceptance criteria committed yet.",
    "planned": "Scoped and queued; not the current active slice.",
    "active": "The single in-progress slice. Only one feature may be active at a time.",
    "blocked": "Cannot proceed until a recorded blocker clears.",
    "passing": "Complete and backed by recorded verification evidence.",
    "done": "Closed and archived; retained only for dependency context."
  },
  "features": [
    {
      "id": "repo-harness-simplification",
      "priority": 0,
      "area": "harness",
      "title": "Lean repo harness",
      "user_visible_behavior": "A new agent can start from AGENTS.md, feature_list.json, and current-state.md without loading the whole harness history.",
      "status": "passing",
      "dependencies": [],
      "verification": [
        "Root startup instructions name only the three always-read files",
        "Harness docs preserve the five-subsystem model and use on-demand routing",
        "Feature and state files are compact enough for every-session reading",
        "JSON and diff checks pass"
      ],
      "evidence": [
        "2026-06-17: Startup, harness skill routing, harness overview, active feature state, current-state handoff, README development guidance, and affected harness docs were compressed to the lightweight five-subsystem model. JSON validation, local Markdown link check, pin policy, stale-reference scans, and git diff checks passed.",
        "2026-06-24: Harness gap-analysis pass against the learn-harness-engineering course closed the remaining missed mechanisms: a status_legend plus a single `active` slice make single_active_feature checkable; a startup baseline gate, decision-rationale capture, boundary-journey table, independent evaluator routing for security changes, agent-oriented-error and verify-before-refactor gates, a representative task set for cleanup decisions, and a mechanical Tauri capability-scope guard test. Tauri tests (incl. the capability guard), pin check, JSON validation, and git diff checks passed."
      ],
      "notes": "Historical evidence remains in docs/harness/evidence/evidence-log.md and product docs. It is not startup context."
    },
    {
      "id": "tauri-alpha-launch-feedback",
      "priority": 1,
      "area": "ui",
      "title": "Tauri alpha launch feedback",
      "user_visible_behavior": "The alpha desktop shell supports setup, dashboard, profile selection, folder picking, run-plan review, confirmed launch, image readiness, sanitized live status, and opt-in bounded raw output snapshots.",
      "status": "passing",
      "dependencies": [
        "rust-cli-conversion",
        "runtime-hardening-macos-only-boundary",
        "run-observability"
      ],
      "verification": [
        "Typed Rust commands and narrow Tauri capabilities cover the exposed UI paths",
        "Frontend and Tauri tests cover launch, readiness, status, and log snapshot behavior",
        "Raw logs stay hidden by default and are not durably stored in frontend state"
      ],
      "evidence": [
        "2026-06-16: Tauri/Svelte scaffold, launch execution, image readiness, resource warnings, live status, raw-log design, and bounded log snapshot slices passed focused Rust, Tauri, frontend, Playwright, and Apple container checks. See docs/harness/evidence/evidence-log.md for command detail."
      ],
      "notes": "This compact row replaces the previous per-slice startup ledger. Detailed slice history remains in the evidence log."
    },
    {
      "id": "tauri-stop-run-control",
      "priority": 1,
      "area": "ui",
      "title": "Tauri stop run control",
      "user_visible_behavior": "The desktop app can stop one validated active RunHaven run only after explicit user confirmation.",
      "status": "passing",
      "dependencies": [
        "tauri-alpha-launch-feedback"
      ],
      "verification": [
        "`stop_run` uses a typed request and response",
        "Rust validates the run id, active marker, and RunHaven-owned container before mutation",
        "The command lives behind a narrow run-control capability",
        "Frontend state does not imply success before the command returns",
        "Focused Rust, Tauri, frontend, and Playwright checks pass"
      ],
      "evidence": [
        "2026-06-25: Completed the v1 desktop maintainability split (milestone 1 / V1-G10) as the prerequisite before adding GUI controls. Split src-tauri/src/commands/mod.rs (528 -> 342) into validation.rs and warnings.rs; split ui/src/commands/runhaven.ts (543) into types.ts/client.ts/plan.ts behind a barrel; split ui/src/app/App.svelte (569 -> 409) into setup/plan-review/last-launch/run-status/run-output panel components. Behavior preserved; Tauri tests (19)/clippy, svelte-check, 15 unit tests, build, and Playwright e2e (2) pass.",
        "2026-06-25: Implemented stop_run. A shared library core `stop_active_run` validates the run id, active marker, and RunHaven-owned container before calling `container stop`, and backs both the CLI `runs_stop` and the typed Tauri `stop_run` command (StopRunRequest/StopRunResponse). stop_run requires confirm_stop, lives behind the narrow `run-control` capability (`allow-stop-run`, added to build.rs and run-control.json; capability_guard confirms it is an allow-* scope), and the RunStatusPanel shows a confirm checkbox plus Stop button whose success state is set only after the command returns. Verified: main `cargo test` (49), Tauri `cargo test` (23, incl. 4 new stop_run tests + capability_guard)/clippy, svelte-check, 15 unit tests, build, and Playwright e2e (2, extended to stop a preview run)."
      ],
      "notes": "First GUI implementation slice after the CLI-complete v0.5.0 scope is closed or explicitly accepted. Add broader run recovery, image, diagnostics, cleanup, and worktree review as separate GUI slices."
    },
    {
      "id": "tauri-kill-repair-run-control",
      "priority": 1,
      "area": "ui",
      "title": "Tauri kill and repair run control",
      "user_visible_behavior": "The desktop app can hard-stop a validated active run and clear a stale active marker, each only after explicit user confirmation. Completes the V1-G3 desktop run-control surface (stop, kill, repair).",
      "status": "passing",
      "dependencies": [
        "tauri-stop-run-control"
      ],
      "verification": [
        "`kill_run` and `repair_run` use typed requests/responses and require explicit confirmation",
        "Rust validates the run id, active marker, and RunHaven-owned container before mutation",
        "Both commands live behind the narrow run-control capability (`allow-kill-run`, `allow-repair-run`)",
        "Frontend state does not imply success before the command returns",
        "Focused Rust, Tauri, frontend, and Playwright checks pass"
      ],
      "evidence": [
        "2026-06-25: Implemented kill_run and repair_run mirroring stop_run. Shared library cores kill_active_run and repair_active_run validate the run id, active marker, and RunHaven-owned container before container kill / stale-marker repair, and back both the CLI runs_kill/runs_repair and the typed Tauri commands. Both require confirmation and sit behind the run-control capability (allow-kill-run, allow-repair-run added to build.rs and run-control.json; capability_guard confirms allow-* scope). RunStatusPanel gained Hard stop and Repair marker controls with per-action confirm checkboxes over shared control state; success messages set only after the command returns. Verified: main cargo test (49), Tauri cargo test (27, incl. 4 new kill/repair tests + capability_guard)/clippy, svelte-check, 15 unit tests, build, and Playwright e2e (2, extended to stop+kill+repair a preview run). Completes V1-G3."
      ],
      "notes": "Run-control mutations (stop/kill/repair) all share one validated library core per action and the narrow run-control capability. Image, state/network cleanup, diagnostics, and worktree review remain separate GUI slices."
    },
    {
      "id": "tauri-diagnostics",
      "priority": 1,
      "area": "ui",
      "title": "Tauri secret-free diagnostics",
      "user_visible_behavior": "The desktop app shows provider egress decisions and auth broker status/log for RunHaven runs, read-only and without secrets or workspace paths.",
      "status": "passing",
      "dependencies": [
        "tauri-alpha-launch-feedback"
      ],
      "verification": [
        "get_egress_log, get_auth_log, and get_auth_status are read-only and return only metadata (no secrets, no workspace paths)",
        "Commands live behind the read-only main-read capability",
        "Structured responses map from existing JSONL records and the auth status payload",
        "Focused Rust, Tauri, frontend, and Playwright checks pass"
      ],
      "evidence": [
        "2026-06-25: Added read-only get_egress_log, get_auth_log, and get_auth_status behind the main-read capability. read_egress_policy_log/read_auth_broker_log back the logs; a new shared auth_status_payload core backs both the CLI auth status and the Tauri command. Responses map only metadata fields (host/port/decision/reason/count, method/path/upstream-status) and intentionally omit workspace paths, mirroring the CLI text output. A self-contained DiagnosticsPanel fetches and renders them on demand, keeping App.svelte lean. Verified: main cargo test (49), Tauri cargo test (30, incl. 3 diagnostics mapper tests + capability_guard)/clippy, svelte-check, 15 unit tests, build, and Playwright e2e (3, incl. a diagnostics load test)."
      ],